{
  "$ref": "#/definitions/testimonials",
  "definitions": {
    "testimonials": {
      "type": "object",
      "properties": {
        "name": {
          "type": "string"
        },
        "role": {
          "type": "string"
        },
        "location": {
          "type": "string"
        },
        "text": {
          "type": "string"
        },
        "image": {
          "type": "string"
        },
        "featured": {
          "type": "boolean",
          "default": false
        },
        "order": {
          "type": "number",
          "default": 0
        },
        "$schema": {
          "type": "string"
        }
      },
      "required": [
        "name",
        "role",
        "location",
        "text"
      ],
      "additionalProperties": false
    }
  },
  "$schema": "http://json-schema.org/draft-07/schema#"
}