{
  "name": "Suruchi Behera",
  "role": "Medical Assistant",
  "location": "Cuttack",
  "text": "At ZDentistry, Dr Zuben and the team provided me with exceptional care, answering all my questions and making me feel at home. They're the only place I trust for my dental needs!",
  "featured": true,
  "order": 2
}
