{
  "name": "Aditya Narayan",
  "role": "Mechanical Engineer",
  "location": "Bhubaneswar",
  "text": "The staff is always friendly and welcoming, and the dentist is truly skilled and compassionate. If you're looking for a great dental practice, look no further than ZDentistry.",
  "featured": true,
  "order": 3
}
